<?xml version="1.0" encoding="utf-8"?>
<?xml-stylesheet type="text/xsl" href="pdml2html.xsl"?>
<!-- You can find pdml2html.xsl in /usr/share/wireshark or at https://code.wireshark.org/review/gitweb?p=wireshark.git;a=blob_plain;f=pdml2html.xsl. -->
<pdml version="0" creator="wireshark/3.2.3" time="Fri Oct 16 12:34:09 2020" capture_file="/tmp/wireshark_wlp2s0_20201016123327_rWbkFk.pcapng">
<packet>
  <proto name="geninfo" pos="0" showname="General information" size="54">
    <field name="num" pos="0" show="1" showname="Number" value="1" size="54"/>
    <field name="len" pos="0" show="54" showname="Frame Length" value="36" size="54"/>
    <field name="caplen" pos="0" show="54" showname="Captured Length" value="36" size="54"/>
    <field name="timestamp" pos="0" show="Oct 16, 2020 12:33:27.158810411 EDT" showname="Captured Time" value="1602866007.158810411" size="54"/>
  </proto>
  <proto name="frame" showname="Frame 1: 54 bytes on wire (432 bits), 54 bytes captured (432 bits) on interface wlp2s0, id 0" size="54" pos="0">
    <field name="frame.interface_id" showname="Interface id: 0 (wlp2s0)" size="0" pos="0" show="0">
      <field name="frame.interface_name" showname="Interface name: wlp2s0" size="0" pos="0" show="wlp2s0"/>
    </field>
    <field name="frame.encap_type" showname="Encapsulation type: Ethernet (1)" size="0" pos="0" show="1"/>
    <field name="frame.time" showname="Arrival Time: Oct 16, 2020 12:33:27.158810411 EDT" size="0" pos="0" show="Oct 16, 2020 12:33:27.158810411 EDT"/>
    <field name="frame.offset_shift" showname="Time shift for this packet: 0.000000000 seconds" size="0" pos="0" show="0.000000000"/>
    <field name="frame.time_epoch" showname="Epoch Time: 1602866007.158810411 seconds" size="0" pos="0" show="1602866007.158810411"/>
    <field name="frame.time_delta" showname="Time delta from previous captured frame: 0.000000000 seconds" size="0" pos="0" show="0.000000000"/>
    <field name="frame.time_delta_displayed" showname="Time delta from previous displayed frame: 0.000000000 seconds" size="0" pos="0" show="0.000000000"/>
    <field name="frame.time_relative" showname="Time since reference or first frame: 0.000000000 seconds" size="0" pos="0" show="0.000000000"/>
    <field name="frame.number" showname="Frame Number: 1" size="0" pos="0" show="1"/>
    <field name="frame.len" showname="Frame Length: 54 bytes (432 bits)" size="0" pos="0" show="54"/>
    <field name="frame.cap_len" showname="Capture Length: 54 bytes (432 bits)" size="0" pos="0" show="54"/>
    <field name="frame.marked" showname="Frame is marked: False" size="0" pos="0" show="0"/>
    <field name="frame.ignored" showname="Frame is ignored: False" size="0" pos="0" show="0"/>
    <field name="frame.protocols" showname="Protocols in frame: eth:ethertype:ip:tcp" size="0" pos="0" show="eth:ethertype:ip:tcp"/>
    <field name="frame.coloring_rule.name" showname="Coloring Rule Name: TCP" size="0" pos="0" show="TCP"/>
    <field name="frame.coloring_rule.string" showname="Coloring Rule String: tcp" size="0" pos="0" show="tcp"/>
  </proto>
  <proto name="eth" showname="Ethernet II, Src: IntelCor_65:ea:e6 (10:f0:05:65:ea:e6), Dst: Verizon_05:1f:27 (48:5d:36:05:1f:27)" size="14" pos="0">
    <field name="eth.dst" showname="Destination: Verizon_05:1f:27 (48:5d:36:05:1f:27)" size="6" pos="0" show="48:5d:36:05:1f:27" value="485d36051f27">
      <field name="eth.dst_resolved" showname="Destination (resolved): Verizon_05:1f:27" hide="yes" size="6" pos="0" show="Verizon_05:1f:27" value="485d36051f27"/>
      <field name="eth.dst.oui" showname="Destination OUI: 48:5d:36 (Verizon)" hide="yes" size="3" pos="0" show="4742454" value="485d36"/>
      <field name="eth.dst.oui_resolved" showname="Destination OUI (resolved): Verizon" hide="yes" size="6" pos="0" show="Verizon" value="485d36051f27"/>
      <field name="eth.addr" showname="Address: Verizon_05:1f:27 (48:5d:36:05:1f:27)" size="6" pos="0" show="48:5d:36:05:1f:27" value="485d36051f27"/>
      <field name="eth.addr_resolved" showname="Address (resolved): Verizon_05:1f:27" hide="yes" size="6" pos="0" show="Verizon_05:1f:27" value="485d36051f27"/>
      <field name="eth.addr.oui" showname="Address OUI: 48:5d:36 (Verizon)" hide="yes" size="3" pos="0" show="4742454" value="485d36"/>
      <field name="eth.addr.oui_resolved" showname="Address OUI (resolved): Verizon" hide="yes" size="6" pos="0" show="Verizon" value="485d36051f27"/>
      <field name="eth.dst.lg" showname=".... ..0. .... .... .... .... = LG bit: Globally unique address (factory default)" size="3" pos="0" show="0" value="0" unmaskedvalue="485d36"/>
      <field name="eth.lg" showname=".... ..0. .... .... .... .... = LG bit: Globally unique address (factory default)" hide="yes" size="3" pos="0" show="0" value="0" unmaskedvalue="485d36"/>
      <field name="eth.dst.ig" showname=".... ...0 .... .... .... .... = IG bit: Individual address (unicast)" size="3" pos="0" show="0" value="0" unmaskedvalue="485d36"/>
      <field name="eth.ig" showname=".... ...0 .... .... .... .... = IG bit: Individual address (unicast)" hide="yes" size="3" pos="0" show="0" value="0" unmaskedvalue="485d36"/>
    </field>
    <field name="eth.src" showname="Source: IntelCor_65:ea:e6 (10:f0:05:65:ea:e6)" size="6" pos="6" show="10:f0:05:65:ea:e6" value="10f00565eae6">
      <field name="eth.src_resolved" showname="Source (resolved): IntelCor_65:ea:e6" hide="yes" size="6" pos="6" show="IntelCor_65:ea:e6" value="10f00565eae6"/>
      <field name="eth.src.oui" showname="Source OUI: 10:f0:05 (Intel Corporate)" hide="yes" size="3" pos="6" show="1110021" value="10f005"/>
      <field name="eth.src.oui_resolved" showname="Source OUI (resolved): Intel Corporate" hide="yes" size="6" pos="6" show="Intel Corporate" value="10f00565eae6"/>
      <field name="eth.addr" showname="Address: IntelCor_65:ea:e6 (10:f0:05:65:ea:e6)" size="6" pos="6" show="10:f0:05:65:ea:e6" value="10f00565eae6"/>
      <field name="eth.addr_resolved" showname="Address (resolved): IntelCor_65:ea:e6" hide="yes" size="6" pos="6" show="IntelCor_65:ea:e6" value="10f00565eae6"/>
      <field name="eth.addr.oui" showname="Address OUI: 10:f0:05 (Intel Corporate)" hide="yes" size="3" pos="6" show="1110021" value="10f005"/>
      <field name="eth.addr.oui_resolved" showname="Address OUI (resolved): Intel Corporate" hide="yes" size="6" pos="6" show="Intel Corporate" value="10f00565eae6"/>
      <field name="eth.src.lg" showname=".... ..0. .... .... .... .... = LG bit: Globally unique address (factory default)" size="3" pos="6" show="0" value="0" unmaskedvalue="10f005"/>
      <field name="eth.lg" showname=".... ..0. .... .... .... .... = LG bit: Globally unique address (factory default)" hide="yes" size="3" pos="6" show="0" value="0" unmaskedvalue="10f005"/>
      <field name="eth.src.ig" showname=".... ...0 .... .... .... .... = IG bit: Individual address (unicast)" size="3" pos="6" show="0" value="0" unmaskedvalue="10f005"/>
      <field name="eth.ig" showname=".... ...0 .... .... .... .... = IG bit: Individual address (unicast)" hide="yes" size="3" pos="6" show="0" value="0" unmaskedvalue="10f005"/>
    </field>
    <field name="eth.type" showname="Type: IPv4 (0x0800)" size="2" pos="12" show="0x00000800" value="0800"/>
  </proto>
  <proto name="ip" showname="Internet Protocol Version 4, Src: 192.168.1.172, Dst: 52.96.32.178" size="20" pos="14">
    <field name="ip.version" showname="0100 .... = Version: 4" size="1" pos="14" show="4" value="4" unmaskedvalue="45"/>
    <field name="ip.hdr_len" showname=".... 0101 = Header Length: 20 bytes (5)" size="1" pos="14" show="20" value="45"/>
    <field name="ip.dsfield" showname="Differentiated Services Field: 0x00 (DSCP: CS0, ECN: Not-ECT)" size="1" pos="15" show="0x00000000" value="00">
      <field name="ip.dsfield.dscp" showname="0000 00.. = Differentiated Services Codepoint: Default (0)" size="1" pos="15" show="0" value="0" unmaskedvalue="00"/>
      <field name="ip.dsfield.ecn" showname=".... ..00 = Explicit Congestion Notification: Not ECN-Capable Transport (0)" size="1" pos="15" show="0" value="0" unmaskedvalue="00"/>
    </field>
    <field name="ip.len" showname="Total Length: 40" size="2" pos="16" show="40" value="0028"/>
    <field name="ip.id" showname="Identification: 0xd176 (53622)" size="2" pos="18" show="0x0000d176" value="d176"/>
    <field name="ip.flags" showname="Flags: 0x4000, Don&#x27;t fragment" size="2" pos="20" show="0x00004000" value="4000">
      <field name="ip.flags.rb" showname="0... .... .... .... = Reserved bit: Not set" size="2" pos="20" show="0" value="0" unmaskedvalue="4000"/>
      <field name="ip.flags.df" showname=".1.. .... .... .... = Don&#x27;t fragment: Set" size="2" pos="20" show="1" value="1" unmaskedvalue="4000"/>
      <field name="ip.flags.mf" showname="..0. .... .... .... = More fragments: Not set" size="2" pos="20" show="0" value="0" unmaskedvalue="4000"/>
    </field>
    <field name="ip.frag_offset" showname="Fragment offset: 0" size="2" pos="20" show="0" value="4000"/>
    <field name="ip.ttl" showname="Time to live: 64" size="1" pos="22" show="64" value="40"/>
    <field name="ip.proto" showname="Protocol: TCP (6)" size="1" pos="23" show="6" value="06"/>
    <field name="ip.checksum" showname="Header checksum: 0x51f3 [validation disabled]" size="2" pos="24" show="0x000051f3" value="51f3"/>
    <field name="ip.checksum.status" showname="Header checksum status: Unverified" size="0" pos="24" show="2"/>
    <field name="ip.src" showname="Source: 192.168.1.172" size="4" pos="26" show="192.168.1.172" value="c0a801ac"/>
    <field name="ip.addr" showname="Source or Destination Address: 192.168.1.172" hide="yes" size="4" pos="26" show="192.168.1.172" value="c0a801ac"/>
    <field name="ip.src_host" showname="Source Host: 192.168.1.172" hide="yes" size="4" pos="26" show="192.168.1.172" value="c0a801ac"/>
    <field name="ip.host" showname="Source or Destination Host: 192.168.1.172" hide="yes" size="4" pos="26" show="192.168.1.172" value="c0a801ac"/>
    <field name="ip.dst" showname="Destination: 52.96.32.178" size="4" pos="30" show="52.96.32.178" value="346020b2"/>
    <field name="ip.addr" showname="Source or Destination Address: 52.96.32.178" hide="yes" size="4" pos="30" show="52.96.32.178" value="346020b2"/>
    <field name="ip.dst_host" showname="Destination Host: 52.96.32.178" hide="yes" size="4" pos="30" show="52.96.32.178" value="346020b2"/>
    <field name="ip.host" showname="Source or Destination Host: 52.96.32.178" hide="yes" size="4" pos="30" show="52.96.32.178" value="346020b2"/>
  </proto>
  <proto name="tcp" showname="Transmission Control Protocol, Src Port: 41274, Dst Port: 443, Seq: 1, Ack: 1, Len: 0" size="20" pos="34">
    <field name="tcp.srcport" showname="Source Port: 41274" size="2" pos="34" show="41274" value="a13a"/>
    <field name="tcp.dstport" showname="Destination Port: 443" size="2" pos="36" show="443" value="01bb"/>
    <field name="tcp.port" showname="Source or Destination Port: 41274" hide="yes" size="2" pos="34" show="41274" value="a13a"/>
    <field name="tcp.port" showname="Source or Destination Port: 443" hide="yes" size="2" pos="36" show="443" value="01bb"/>
    <field name="tcp.stream" showname="Stream index: 0" size="0" pos="34" show="0"/>
    <field name="tcp.len" showname="TCP Segment Len: 0" size="1" pos="46" show="0" value="50"/>
    <field name="tcp.seq" showname="Sequence number: 1    (relative sequence number)" size="4" pos="38" show="1" value="a9096f22"/>
    <field name="tcp.seq_raw" showname="Sequence number (raw): 2835967778" size="4" pos="38" show="2835967778" value="a9096f22"/>
    <field name="tcp.nxtseq" showname="Next sequence number: 1    (relative sequence number)" size="0" pos="34" show="1"/>
    <field name="tcp.ack" showname="Acknowledgment number: 1    (relative ack number)" size="4" pos="42" show="1" value="09f6897d"/>
    <field name="tcp.ack_raw" showname="Acknowledgment number (raw): 167151997" size="4" pos="42" show="167151997" value="09f6897d"/>
    <field name="tcp.hdr_len" showname="0101 .... = Header Length: 20 bytes (5)" size="1" pos="46" show="20" value="50"/>
    <field name="tcp.flags" showname="Flags: 0x010 (ACK)" size="2" pos="46" show="0x00000010" value="10" unmaskedvalue="5010">
      <field name="tcp.flags.res" showname="000. .... .... = Reserved: Not set" size="1" pos="46" show="0" value="0" unmaskedvalue="50"/>
      <field name="tcp.flags.ns" showname="...0 .... .... = Nonce: Not set" size="1" pos="46" show="0" value="0" unmaskedvalue="50"/>
      <field name="tcp.flags.cwr" showname=".... 0... .... = Congestion Window Reduced (CWR): Not set" size="1" pos="47" show="0" value="0" unmaskedvalue="10"/>
      <field name="tcp.flags.ecn" showname=".... .0.. .... = ECN-Echo: Not set" size="1" pos="47" show="0" value="0" unmaskedvalue="10"/>
      <field name="tcp.flags.urg" showname=".... ..0. .... = Urgent: Not set" size="1" pos="47" show="0" value="0" unmaskedvalue="10"/>
      <field name="tcp.flags.ack" showname=".... ...1 .... = Acknowledgment: Set" size="1" pos="47" show="1" value="1" unmaskedvalue="10"/>
      <field name="tcp.flags.push" showname=".... .... 0... = Push: Not set" size="1" pos="47" show="0" value="0" unmaskedvalue="10"/>
      <field name="tcp.flags.reset" showname=".... .... .0.. = Reset: Not set" size="1" pos="47" show="0" value="0" unmaskedvalue="10"/>
      <field name="tcp.flags.syn" showname=".... .... ..0. = Syn: Not set" size="1" pos="47" show="0" value="0" unmaskedvalue="10"/>
      <field name="tcp.flags.fin" showname=".... .... ...0 = Fin: Not set" size="1" pos="47" show="0" value="0" unmaskedvalue="10"/>
      <field name="tcp.flags.str" showname="TCP Flags: \xc2\xb7\xc2\xb7\xc2\xb7\xc2\xb7\xc2\xb7\xc2\xb7\xc2\xb7A\xc2\xb7\xc2\xb7\xc2\xb7\xc2\xb7" size="2" pos="46" show="\xc2\xb7\xc2\xb7\xc2\xb7\xc2\xb7\xc2\xb7\xc2\xb7\xc2\xb7A\xc2\xb7\xc2\xb7\xc2\xb7\xc2\xb7" value="5010"/>
    </field>
    <field name="tcp.window_size_value" showname="Window size value: 501" size="2" pos="48" show="501" value="01f5"/>
    <field name="tcp.window_size" showname="Calculated window size: 501" size="2" pos="48" show="501" value="01f5"/>
    <field name="tcp.window_size_scalefactor" showname="Window size scaling factor: -1 (unknown)" size="2" pos="48" show="-1" value="01f5"/>
    <field name="tcp.checksum" showname="Checksum: 0x47e4 [unverified]" size="2" pos="50" show="0x000047e4" value="47e4"/>
    <field name="tcp.checksum.status" showname="Checksum Status: Unverified" size="0" pos="50" show="2"/>
    <field name="tcp.urgent_pointer" showname="Urgent pointer: 0" size="2" pos="52" show="0" value="0000"/>
    <field name="" show="Timestamps" size="0" pos="34">
      <field name="tcp.time_relative" showname="Time since first frame in this TCP stream: 0.000000000 seconds" size="0" pos="34" show="0.000000000"/>
      <field name="tcp.time_delta" showname="Time since previous frame in this TCP stream: 0.000000000 seconds" size="0" pos="34" show="0.000000000"/>
    </field>
  </proto>
</packet>

<packet>
  <proto name="geninfo" pos="0" showname="General information" size="64">
    <field name="num" pos="0" show="2" showname="Number" value="2" size="64"/>
    <field name="len" pos="0" show="64" showname="Frame Length" value="40" size="64"/>
    <field name="caplen" pos="0" show="64" showname="Captured Length" value="40" size="64"/>
    <field name="timestamp" pos="0" show="Oct 16, 2020 12:33:27.166943955 EDT" showname="Captured Time" value="1602866007.166943955" size="64"/>
  </proto>
  <proto name="frame" showname="Frame 2: 64 bytes on wire (512 bits), 64 bytes captured (512 bits) on interface wlp2s0, id 0" size="64" pos="0">
    <field name="frame.interface_id" showname="Interface id: 0 (wlp2s0)" size="0" pos="0" show="0">
      <field name="frame.interface_name" showname="Interface name: wlp2s0" size="0" pos="0" show="wlp2s0"/>
    </field>
    <field name="frame.encap_type" showname="Encapsulation type: Ethernet (1)" size="0" pos="0" show="1"/>
    <field name="frame.time" showname="Arrival Time: Oct 16, 2020 12:33:27.166943955 EDT" size="0" pos="0" show="Oct 16, 2020 12:33:27.166943955 EDT"/>
    <field name="frame.offset_shift" showname="Time shift for this packet: 0.000000000 seconds" size="0" pos="0" show="0.000000000"/>
    <field name="frame.time_epoch" showname="Epoch Time: 1602866007.166943955 seconds" size="0" pos="0" show="1602866007.166943955"/>
    <field name="frame.time_delta" showname="Time delta from previous captured frame: 0.008133544 seconds" size="0" pos="0" show="0.008133544"/>
    <field name="frame.time_delta_displayed" showname="Time delta from previous displayed frame: 0.008133544 seconds" size="0" pos="0" show="0.008133544"/>
    <field name="frame.time_relative" showname="Time since reference or first frame: 0.008133544 seconds" size="0" pos="0" show="0.008133544"/>
    <field name="frame.number" showname="Frame Number: 2" size="0" pos="0" show="2"/>
    <field name="frame.len" showname="Frame Length: 64 bytes (512 bits)" size="0" pos="0" show="64"/>
    <field name="frame.cap_len" showname="Capture Length: 64 bytes (512 bits)" size="0" pos="0" show="64"/>
    <field name="frame.marked" showname="Frame is marked: False" size="0" pos="0" show="0"/>
    <field name="frame.ignored" showname="Frame is ignored: False" size="0" pos="0" show="0"/>
    <field name="frame.protocols" showname="Protocols in frame: eth:ethertype:ip:tcp" size="0" pos="0" show="eth:ethertype:ip:tcp"/>
    <field name="frame.coloring_rule.name" showname="Coloring Rule Name: Bad TCP" size="0" pos="0" show="Bad TCP"/>
    <field name="frame.coloring_rule.string" showname="Coloring Rule String: tcp.analysis.flags &amp;&amp; !tcp.analysis.window_update" size="0" pos="0" show="tcp.analysis.flags &amp;&amp; !tcp.analysis.window_update"/>
  </proto>
  <proto name="eth" showname="Ethernet II, Src: Verizon_05:1f:27 (48:5d:36:05:1f:27), Dst: IntelCor_65:ea:e6 (10:f0:05:65:ea:e6)" size="14" pos="0">
    <field name="eth.dst" showname="Destination: IntelCor_65:ea:e6 (10:f0:05:65:ea:e6)" size="6" pos="0" show="10:f0:05:65:ea:e6" value="10f00565eae6">
      <field name="eth.dst_resolved" showname="Destination (resolved): IntelCor_65:ea:e6" hide="yes" size="6" pos="0" show="IntelCor_65:ea:e6" value="10f00565eae6"/>
      <field name="eth.dst.oui" showname="Destination OUI: 10:f0:05 (Intel Corporate)" hide="yes" size="3" pos="0" show="1110021" value="10f005"/>
      <field name="eth.dst.oui_resolved" showname="Destination OUI (resolved): Intel Corporate" hide="yes" size="6" pos="0" show="Intel Corporate" value="10f00565eae6"/>
      <field name="eth.addr" showname="Address: IntelCor_65:ea:e6 (10:f0:05:65:ea:e6)" size="6" pos="0" show="10:f0:05:65:ea:e6" value="10f00565eae6"/>
      <field name="eth.addr_resolved" showname="Address (resolved): IntelCor_65:ea:e6" hide="yes" size="6" pos="0" show="IntelCor_65:ea:e6" value="10f00565eae6"/>
      <field name="eth.addr.oui" showname="Address OUI: 10:f0:05 (Intel Corporate)" hide="yes" size="3" pos="0" show="1110021" value="10f005"/>
      <field name="eth.addr.oui_resolved" showname="Address OUI (resolved): Intel Corporate" hide="yes" size="6" pos="0" show="Intel Corporate" value="10f00565eae6"/>
      <field name="eth.dst.lg" showname=".... ..0. .... .... .... .... = LG bit: Globally unique address (factory default)" size="3" pos="0" show="0" value="0" unmaskedvalue="10f005"/>
      <field name="eth.lg" showname=".... ..0. .... .... .... .... = LG bit: Globally unique address (factory default)" hide="yes" size="3" pos="0" show="0" value="0" unmaskedvalue="10f005"/>
      <field name="eth.dst.ig" showname=".... ...0 .... .... .... .... = IG bit: Individual address (unicast)" size="3" pos="0" show="0" value="0" unmaskedvalue="10f005"/>
      <field name="eth.ig" showname=".... ...0 .... .... .... .... = IG bit: Individual address (unicast)" hide="yes" size="3" pos="0" show="0" value="0" unmaskedvalue="10f005"/>
    </field>
    <field name="eth.src" showname="Source: Verizon_05:1f:27 (48:5d:36:05:1f:27)" size="6" pos="6" show="48:5d:36:05:1f:27" value="485d36051f27">
      <field name="eth.src_resolved" showname="Source (resolved): Verizon_05:1f:27" hide="yes" size="6" pos="6" show="Verizon_05:1f:27" value="485d36051f27"/>
      <field name="eth.src.oui" showname="Source OUI: 48:5d:36 (Verizon)" hide="yes" size="3" pos="6" show="4742454" value="485d36"/>
      <field name="eth.src.oui_resolved" showname="Source OUI (resolved): Verizon" hide="yes" size="6" pos="6" show="Verizon" value="485d36051f27"/>
      <field name="eth.addr" showname="Address: Verizon_05:1f:27 (48:5d:36:05:1f:27)" size="6" pos="6" show="48:5d:36:05:1f:27" value="485d36051f27"/>
      <field name="eth.addr_resolved" showname="Address (resolved): Verizon_05:1f:27" hide="yes" size="6" pos="6" show="Verizon_05:1f:27" value="485d36051f27"/>
      <field name="eth.addr.oui" showname="Address OUI: 48:5d:36 (Verizon)" hide="yes" size="3" pos="6" show="4742454" value="485d36"/>
      <field name="eth.addr.oui_resolved" showname="Address OUI (resolved): Verizon" hide="yes" size="6" pos="6" show="Verizon" value="485d36051f27"/>
      <field name="eth.src.lg" showname=".... ..0. .... .... .... .... = LG bit: Globally unique address (factory default)" size="3" pos="6" show="0" value="0" unmaskedvalue="485d36"/>
      <field name="eth.lg" showname=".... ..0. .... .... .... .... = LG bit: Globally unique address (factory default)" hide="yes" size="3" pos="6" show="0" value="0" unmaskedvalue="485d36"/>
      <field name="eth.src.ig" showname=".... ...0 .... .... .... .... = IG bit: Individual address (unicast)" size="3" pos="6" show="0" value="0" unmaskedvalue="485d36"/>
      <field name="eth.ig" showname=".... ...0 .... .... .... .... = IG bit: Individual address (unicast)" hide="yes" size="3" pos="6" show="0" value="0" unmaskedvalue="485d36"/>
    </field>
    <field name="eth.type" showname="Type: IPv4 (0x0800)" size="2" pos="12" show="0x00000800" value="0800"/>
    <field name="eth.padding" showname="Padding: 56e800000000" size="6" pos="54" show="56:e8:00:00:00:00" value="56e800000000"/>
    <field name="eth.fcs" showname="Frame check sequence: 0x00000000 [unverified]" size="4" pos="60" show="0x00000000" value="00000000"/>
    <field name="eth.fcs.status" showname="FCS Status: Unverified" size="0" pos="60" show="2"/>
  </proto>
  <proto name="ip" showname="Internet Protocol Version 4, Src: 52.96.32.178, Dst: 192.168.1.172" size="20" pos="14">
    <field name="ip.version" showname="0100 .... = Version: 4" size="1" pos="14" show="4" value="4" unmaskedvalue="45"/>
    <field name="ip.hdr_len" showname=".... 0101 = Header Length: 20 bytes (5)" size="1" pos="14" show="20" value="45"/>
    <field name="ip.dsfield" showname="Differentiated Services Field: 0x00 (DSCP: CS0, ECN: Not-ECT)" size="1" pos="15" show="0x00000000" value="00">
      <field name="ip.dsfield.dscp" showname="0000 00.. = Differentiated Services Codepoint: Default (0)" size="1" pos="15" show="0" value="0" unmaskedvalue="00"/>
      <field name="ip.dsfield.ecn" showname=".... ..00 = Explicit Congestion Notification: Not ECN-Capable Transport (0)" size="1" pos="15" show="0" value="0" unmaskedvalue="00"/>
    </field>
    <field name="ip.len" showname="Total Length: 40" size="2" pos="16" show="40" value="0028"/>
    <field name="ip.id" showname="Identification: 0x4841 (18497)" size="2" pos="18" show="0x00004841" value="4841"/>
    <field name="ip.flags" showname="Flags: 0x4000, Don&#x27;t fragment" size="2" pos="20" show="0x00004000" value="4000">
      <field name="ip.flags.rb" showname="0... .... .... .... = Reserved bit: Not set" size="2" pos="20" show="0" value="0" unmaskedvalue="4000"/>
      <field name="ip.flags.df" showname=".1.. .... .... .... = Don&#x27;t fragment: Set" size="2" pos="20" show="1" value="1" unmaskedvalue="4000"/>
      <field name="ip.flags.mf" showname="..0. .... .... .... = More fragments: Not set" size="2" pos="20" show="0" value="0" unmaskedvalue="4000"/>
    </field>
    <field name="ip.frag_offset" showname="Fragment offset: 0" size="2" pos="20" show="0" value="4000"/>
    <field name="ip.ttl" showname="Time to live: 245" size="1" pos="22" show="245" value="f5"/>
    <field name="ip.proto" showname="Protocol: TCP (6)" size="1" pos="23" show="6" value="06"/>
    <field name="ip.checksum" showname="Header checksum: 0x2628 [validation disabled]" size="2" pos="24" show="0x00002628" value="2628"/>
    <field name="ip.checksum.status" showname="Header checksum status: Unverified" size="0" pos="24" show="2"/>
    <field name="ip.src" showname="Source: 52.96.32.178" size="4" pos="26" show="52.96.32.178" value="346020b2"/>
    <field name="ip.addr" showname="Source or Destination Address: 52.96.32.178" hide="yes" size="4" pos="26" show="52.96.32.178" value="346020b2"/>
    <field name="ip.src_host" showname="Source Host: 52.96.32.178" hide="yes" size="4" pos="26" show="52.96.32.178" value="346020b2"/>
    <field name="ip.host" showname="Source or Destination Host: 52.96.32.178" hide="yes" size="4" pos="26" show="52.96.32.178" value="346020b2"/>
    <field name="ip.dst" showname="Destination: 192.168.1.172" size="4" pos="30" show="192.168.1.172" value="c0a801ac"/>
    <field name="ip.addr" showname="Source or Destination Address: 192.168.1.172" hide="yes" size="4" pos="30" show="192.168.1.172" value="c0a801ac"/>
    <field name="ip.dst_host" showname="Destination Host: 192.168.1.172" hide="yes" size="4" pos="30" show="192.168.1.172" value="c0a801ac"/>
    <field name="ip.host" showname="Source or Destination Host: 192.168.1.172" hide="yes" size="4" pos="30" show="192.168.1.172" value="c0a801ac"/>
  </proto>
  <proto name="tcp" showname="Transmission Control Protocol, Src Port: 443, Dst Port: 41274, Seq: 1, Ack: 2, Len: 0" size="20" pos="34">
    <field name="tcp.srcport" showname="Source Port: 443" size="2" pos="34" show="443" value="01bb"/>
    <field name="tcp.dstport" showname="Destination Port: 41274" size="2" pos="36" show="41274" value="a13a"/>
    <field name="tcp.port" showname="Source or Destination Port: 443" hide="yes" size="2" pos="34" show="443" value="01bb"/>
    <field name="tcp.port" showname="Source or Destination Port: 41274" hide="yes" size="2" pos="36" show="41274" value="a13a"/>
    <field name="tcp.stream" showname="Stream index: 0" size="0" pos="34" show="0"/>
    <field name="tcp.len" showname="TCP Segment Len: 0" size="1" pos="46" show="0" value="50"/>
    <field name="tcp.seq" showname="Sequence number: 1    (relative sequence number)" size="4" pos="38" show="1" value="09f6897d"/>
    <field name="tcp.seq_raw" showname="Sequence number (raw): 167151997" size="4" pos="38" show="167151997" value="09f6897d"/>
    <field name="tcp.nxtseq" showname="Next sequence number: 1    (relative sequence number)" size="0" pos="34" show="1"/>
    <field name="tcp.ack" showname="Acknowledgment number: 2    (relative ack number)" size="4" pos="42" show="2" value="a9096f23"/>
    <field name="tcp.ack_raw" showname="Acknowledgment number (raw): 2835967779" size="4" pos="42" show="2835967779" value="a9096f23"/>
    <field name="tcp.hdr_len" showname="0101 .... = Header Length: 20 bytes (5)" size="1" pos="46" show="20" value="50"/>
    <field name="tcp.flags" showname="Flags: 0x010 (ACK)" size="2" pos="46" show="0x00000010" value="10" unmaskedvalue="5010">
      <field name="tcp.flags.res" showname="000. .... .... = Reserved: Not set" size="1" pos="46" show="0" value="0" unmaskedvalue="50"/>
      <field name="tcp.flags.ns" showname="...0 .... .... = Nonce: Not set" size="1" pos="46" show="0" value="0" unmaskedvalue="50"/>
      <field name="tcp.flags.cwr" showname=".... 0... .... = Congestion Window Reduced (CWR): Not set" size="1" pos="47" show="0" value="0" unmaskedvalue="10"/>
      <field name="tcp.flags.ecn" showname=".... .0.. .... = ECN-Echo: Not set" size="1" pos="47" show="0" value="0" unmaskedvalue="10"/>
      <field name="tcp.flags.urg" showname=".... ..0. .... = Urgent: Not set" size="1" pos="47" show="0" value="0" unmaskedvalue="10"/>
      <field name="tcp.flags.ack" showname=".... ...1 .... = Acknowledgment: Set" size="1" pos="47" show="1" value="1" unmaskedvalue="10"/>
      <field name="tcp.flags.push" showname=".... .... 0... = Push: Not set" size="1" pos="47" show="0" value="0" unmaskedvalue="10"/>
      <field name="tcp.flags.reset" showname=".... .... .0.. = Reset: Not set" size="1" pos="47" show="0" value="0" unmaskedvalue="10"/>
      <field name="tcp.flags.syn" showname=".... .... ..0. = Syn: Not set" size="1" pos="47" show="0" value="0" unmaskedvalue="10"/>
      <field name="tcp.flags.fin" showname=".... .... ...0 = Fin: Not set" size="1" pos="47" show="0" value="0" unmaskedvalue="10"/>
      <field name="tcp.flags.str" showname="TCP Flags: \xc2\xb7\xc2\xb7\xc2\xb7\xc2\xb7\xc2\xb7\xc2\xb7\xc2\xb7A\xc2\xb7\xc2\xb7\xc2\xb7\xc2\xb7" size="2" pos="46" show="\xc2\xb7\xc2\xb7\xc2\xb7\xc2\xb7\xc2\xb7\xc2\xb7\xc2\xb7A\xc2\xb7\xc2\xb7\xc2\xb7\xc2\xb7" value="5010"/>
    </field>
    <field name="tcp.window_size_value" showname="Window size value: 2048" size="2" pos="48" show="2048" value="0800"/>
    <field name="tcp.window_size" showname="Calculated window size: 2048" size="2" pos="48" show="2048" value="0800"/>
    <field name="tcp.window_size_scalefactor" showname="Window size scaling factor: -1 (unknown)" size="2" pos="48" show="-1" value="0800"/>
    <field name="tcp.checksum" showname="Checksum: 0x41d8 [unverified]" size="2" pos="50" show="0x000041d8" value="41d8"/>
    <field name="tcp.checksum.status" showname="Checksum Status: Unverified" size="0" pos="50" show="2"/>
    <field name="tcp.urgent_pointer" showname="Urgent pointer: 0" size="2" pos="52" show="0" value="0000"/>
    <field name="tcp.analysis" showname="SEQ/ACK analysis" size="0" pos="34" show="" value="">
      <field name="tcp.analysis.flags" showname="TCP Analysis Flags" size="0" pos="34" show="" value="">
        <field name="_ws.expert" showname="Expert Info (Warning/Sequence): ACKed segment that wasn&#x27;t captured (common at capture start)" size="0" pos="34">
          <field name="tcp.analysis.ack_lost_segment" showname="ACKed segment that wasn&#x27;t captured (common at capture start)" size="0" pos="0" show="" value=""/>
          <field name="_ws.expert.message" showname="Message: ACKed segment that wasn&#x27;t captured (common at capture start)" hide="yes" size="0" pos="0" show="ACKed segment that wasn&#x27;t captured (common at capture start)"/>
          <field name="_ws.expert.severity" showname="Severity level: Warning" size="0" pos="0" show="6291456"/>
          <field name="_ws.expert.group" showname="Group: Sequence" size="0" pos="0" show="33554432"/>
        </field>
      </field>
    </field>
    <field name="" show="Timestamps" size="0" pos="34">
      <field name="tcp.time_relative" showname="Time since first frame in this TCP stream: 0.008133544 seconds" size="0" pos="34" show="0.008133544"/>
      <field name="tcp.time_delta" showname="Time since previous frame in this TCP stream: 0.008133544 seconds" size="0" pos="34" show="0.008133544"/>
    </field>
  </proto>
</packet>

<packet>
  <proto name="geninfo" pos="0" showname="General information" size="66">
    <field name="num" pos="0" show="3" showname="Number" value="3" size="66"/>
    <field name="len" pos="0" show="66" showname="Frame Length" value="42" size="66"/>
    <field name="caplen" pos="0" show="66" showname="Captured Length" value="42" size="66"/>
    <field name="timestamp" pos="0" show="Oct 16, 2020 12:33:29.206895197 EDT" showname="Captured Time" value="1602866009.206895197" size="66"/>
  </proto>
  <proto name="frame" showname="Frame 3: 66 bytes on wire (528 bits), 66 bytes captured (528 bits) on interface wlp2s0, id 0" size="66" pos="0">
    <field name="frame.interface_id" showname="Interface id: 0 (wlp2s0)" size="0" pos="0" show="0">
      <field name="frame.interface_name" showname="Interface name: wlp2s0" size="0" pos="0" show="wlp2s0"/>
    </field>
    <field name="frame.encap_type" showname="Encapsulation type: Ethernet (1)" size="0" pos="0" show="1"/>
    <field name="frame.time" showname="Arrival Time: Oct 16, 2020 12:33:29.206895197 EDT" size="0" pos="0" show="Oct 16, 2020 12:33:29.206895197 EDT"/>
    <field name="frame.offset_shift" showname="Time shift for this packet: 0.000000000 seconds" size="0" pos="0" show="0.000000000"/>
    <field name="frame.time_epoch" showname="Epoch Time: 1602866009.206895197 seconds" size="0" pos="0" show="1602866009.206895197"/>
    <field name="frame.time_delta" showname="Time delta from previous captured frame: 2.039951242 seconds" size="0" pos="0" show="2.039951242"/>
    <field name="frame.time_delta_displayed" showname="Time delta from previous displayed frame: 2.039951242 seconds" size="0" pos="0" show="2.039951242"/>
    <field name="frame.time_relative" showname="Time since reference or first frame: 2.048084786 seconds" size="0" pos="0" show="2.048084786"/>
    <field name="frame.number" showname="Frame Number: 3" size="0" pos="0" show="3"/>
    <field name="frame.len" showname="Frame Length: 66 bytes (528 bits)" size="0" pos="0" show="66"/>
    <field name="frame.cap_len" showname="Capture Length: 66 bytes (528 bits)" size="0" pos="0" show="66"/>
    <field name="frame.marked" showname="Frame is marked: False" size="0" pos="0" show="0"/>
    <field name="frame.ignored" showname="Frame is ignored: False" size="0" pos="0" show="0"/>
    <field name="frame.protocols" showname="Protocols in frame: eth:ethertype:ip:tcp" size="0" pos="0" show="eth:ethertype:ip:tcp"/>
    <field name="frame.coloring_rule.name" showname="Coloring Rule Name: TCP" size="0" pos="0" show="TCP"/>
    <field name="frame.coloring_rule.string" showname="Coloring Rule String: tcp" size="0" pos="0" show="tcp"/>
  </proto>
  <proto name="eth" showname="Ethernet II, Src: IntelCor_65:ea:e6 (10:f0:05:65:ea:e6), Dst: Verizon_05:1f:27 (48:5d:36:05:1f:27)" size="14" pos="0">
    <field name="eth.dst" showname="Destination: Verizon_05:1f:27 (48:5d:36:05:1f:27)" size="6" pos="0" show="48:5d:36:05:1f:27" value="485d36051f27">
      <field name="eth.dst_resolved" showname="Destination (resolved): Verizon_05:1f:27" hide="yes" size="6" pos="0" show="Verizon_05:1f:27" value="485d36051f27"/>
      <field name="eth.dst.oui" showname="Destination OUI: 48:5d:36 (Verizon)" hide="yes" size="3" pos="0" show="4742454" value="485d36"/>
      <field name="eth.dst.oui_resolved" showname="Destination OUI (resolved): Verizon" hide="yes" size="6" pos="0" show="Verizon" value="485d36051f27"/>
      <field name="eth.addr" showname="Address: Verizon_05:1f:27 (48:5d:36:05:1f:27)" size="6" pos="0" show="48:5d:36:05:1f:27" value="485d36051f27"/>
      <field name="eth.addr_resolved" showname="Address (resolved): Verizon_05:1f:27" hide="yes" size="6" pos="0" show="Verizon_05:1f:27" value="485d36051f27"/>
      <field name="eth.addr.oui" showname="Address OUI: 48:5d:36 (Verizon)" hide="yes" size="3" pos="0" show="4742454" value="485d36"/>
      <field name="eth.addr.oui_resolved" showname="Address OUI (resolved): Verizon" hide="yes" size="6" pos="0" show="Verizon" value="485d36051f27"/>
      <field name="eth.dst.lg" showname=".... ..0. .... .... .... .... = LG bit: Globally unique address (factory default)" size="3" pos="0" show="0" value="0" unmaskedvalue="485d36"/>
      <field name="eth.lg" showname=".... ..0. .... .... .... .... = LG bit: Globally unique address (factory default)" hide="yes" size="3" pos="0" show="0" value="0" unmaskedvalue="485d36"/>
      <field name="eth.dst.ig" showname=".... ...0 .... .... .... .... = IG bit: Individual address (unicast)" size="3" pos="0" show="0" value="0" unmaskedvalue="485d36"/>
      <field name="eth.ig" showname=".... ...0 .... .... .... .... = IG bit: Individual address (unicast)" hide="yes" size="3" pos="0" show="0" value="0" unmaskedvalue="485d36"/>
    </field>
    <field name="eth.src" showname="Source: IntelCor_65:ea:e6 (10:f0:05:65:ea:e6)" size="6" pos="6" show="10:f0:05:65:ea:e6" value="10f00565eae6">
      <field name="eth.src_resolved" showname="Source (resolved): IntelCor_65:ea:e6" hide="yes" size="6" pos="6" show="IntelCor_65:ea:e6" value="10f00565eae6"/>
      <field name="eth.src.oui" showname="Source OUI: 10:f0:05 (Intel Corporate)" hide="yes" size="3" pos="6" show="1110021" value="10f005"/>
      <field name="eth.src.oui_resolved" showname="Source OUI (resolved): Intel Corporate" hide="yes" size="6" pos="6" show="Intel Corporate" value="10f00565eae6"/>
      <field name="eth.addr" showname="Address: IntelCor_65:ea:e6 (10:f0:05:65:ea:e6)" size="6" pos="6" show="10:f0:05:65:ea:e6" value="10f00565eae6"/>
      <field name="eth.addr_resolved" showname="Address (resolved): IntelCor_65:ea:e6" hide="yes" size="6" pos="6" show="IntelCor_65:ea:e6" value="10f00565eae6"/>
      <field name="eth.addr.oui" showname="Address OUI: 10:f0:05 (Intel Corporate)" hide="yes" size="3" pos="6" show="1110021" value="10f005"/>
      <field name="eth.addr.oui_resolved" showname="Address OUI (resolved): Intel Corporate" hide="yes" size="6" pos="6" show="Intel Corporate" value="10f00565eae6"/>
      <field name="eth.src.lg" showname=".... ..0. .... .... .... .... = LG bit: Globally unique address (factory default)" size="3" pos="6" show="0" value="0" unmaskedvalue="10f005"/>
      <field name="eth.lg" showname=".... ..0. .... .... .... .... = LG bit: Globally unique address (factory default)" hide="yes" size="3" pos="6" show="0" value="0" unmaskedvalue="10f005"/>
      <field name="eth.src.ig" showname=".... ...0 .... .... .... .... = IG bit: Individual address (unicast)" size="3" pos="6" show="0" value="0" unmaskedvalue="10f005"/>
      <field name="eth.ig" showname=".... ...0 .... .... .... .... = IG bit: Individual address (unicast)" hide="yes" size="3" pos="6" show="0" value="0" unmaskedvalue="10f005"/>
    </field>
    <field name="eth.type" showname="Type: IPv4 (0x0800)" size="2" pos="12" show="0x00000800" value="0800"/>
  </proto>
  <proto name="ip" showname="Internet Protocol Version 4, Src: 192.168.1.172, Dst: 52.149.246.39" size="20" pos="14">
    <field name="ip.version" showname="0100 .... = Version: 4" size="1" pos="14" show="4" value="4" unmaskedvalue="45"/>
    <field name="ip.hdr_len" showname=".... 0101 = Header Length: 20 bytes (5)" size="1" pos="14" show="20" value="45"/>
    <field name="ip.dsfield" showname="Differentiated Services Field: 0x00 (DSCP: CS0, ECN: Not-ECT)" size="1" pos="15" show="0x00000000" value="00">
      <field name="ip.dsfield.dscp" showname="0000 00.. = Differentiated Services Codepoint: Default (0)" size="1" pos="15" show="0" value="0" unmaskedvalue="00"/>
      <field name="ip.dsfield.ecn" showname=".... ..00 = Explicit Congestion Notification: Not ECN-Capable Transport (0)" size="1" pos="15" show="0" value="0" unmaskedvalue="00"/>
    </field>
    <field name="ip.len" showname="Total Length: 52" size="2" pos="16" show="52" value="0034"/>
    <field name="ip.id" showname="Identification: 0x146c (5228)" size="2" pos="18" show="0x0000146c" value="146c"/>
    <field name="ip.flags" showname="Flags: 0x4000, Don&#x27;t fragment" size="2" pos="20" show="0x00004000" value="4000">
      <field name="ip.flags.rb" showname="0... .... .... .... = Reserved bit: Not set" size="2" pos="20" show="0" value="0" unmaskedvalue="4000"/>
      <field name="ip.flags.df" showname=".1.. .... .... .... = Don&#x27;t fragment: Set" size="2" pos="20" show="1" value="1" unmaskedvalue="4000"/>
      <field name="ip.flags.mf" showname="..0. .... .... .... = More fragments: Not set" size="2" pos="20" show="0" value="0" unmaskedvalue="4000"/>
    </field>
    <field name="ip.frag_offset" showname="Fragment offset: 0" size="2" pos="20" show="0" value="4000"/>
    <field name="ip.ttl" showname="Time to live: 64" size="1" pos="22" show="64" value="40"/>
